{
  "schemaVersion": "1.0",
  "script": {
    "title": "最后一班电梯",
    "logline": "一名加班职员在午夜电梯里看见未来的自己，并在升职与救人之间作出选择。",
    "storyPromise": "让观众跟随一个人在截止时间与陌生人的生死之间作出无法撤回的选择，并看见选择的具体代价。",
    "storySummary": "林夏为了赶在午夜前提交升职材料，试图关上电梯门避开受伤的外卖员。电梯故障后，她从门上的倒影看见这个选择留下的未来后果，最终放弃倒计时，扒开电梯门救人。",
    "finalOutcome": "林夏错过升职材料提交时间，却救下周野并主动承担延误造成的职业后果。",
    "targetDurationSeconds": 60,
    "language": "zh-CN",
    "genre": "都市悬疑",
    "style": "写实都市夜景；冷白办公灯、金属表面和暖色应急灯构成主要视觉对照",
    "characters": [
      {
        "name": "林夏",
        "narrativeRole": "主角",
        "description": "二十九岁短发女性，浅灰衬衫与深色长裤；压力增大时会把文件边缘压得发白。",
        "relationships": ["与周野原本互不相识，因电梯里的救援建立短暂联系"]
      },
      {
        "name": "周野",
        "narrativeRole": "触发主角选择的受伤外卖员",
        "description": "二十多岁，黄色防水外套，左前臂被划伤；疼痛时仍先护住怀里的餐盒。",
        "relationships": ["被林夏救下"]
      }
    ],
    "scenes": [
      {
        "sceneIndex": 1,
        "slugline": "INT｜写字楼电梯厅｜午夜前",
        "purpose": "建立主角目标并制造救人与升职之间的冲突",
        "dramaticChange": "林夏从关门回避转为阻止门关闭",
        "environment": "冷白顶灯照亮空旷电梯厅，玻璃门外正在下雨，金属门反射手机屏幕。",
        "characterState": "林夏抱着升职材料站在电梯内；周野穿湿透的黄色外套跑来，左前臂流血。",
        "elements": [
          {"type": "action", "content": "林夏按下关门键，电梯门在周野伸手时开始合拢。"},
          {"type": "dialogue", "speaker": "周野", "performanceCue": "扶墙喘息", "text": "等一下……帮我叫救护车。"},
          {"type": "action", "content": "主灯熄灭，暖色应急灯亮起，林夏看见金属门中的年长倒影。"}
        ]
      },
      {
        "sceneIndex": 2,
        "slugline": "INT｜停在楼层之间的电梯｜午夜",
        "purpose": "展示逃避选择造成的未来后果",
        "dramaticChange": "林夏接受救人的现实代价",
        "environment": "暖色应急灯和手机屏幕照亮金属门，门外敲击逐渐停止。",
        "characterState": "林夏面对年长倒影；升职材料散落在脚边。",
        "elements": [
          {"type": "action", "content": "倒影按住事故名单上的姓名，林夏把手机塞进口袋并双手扒开门。"}
        ]
      },
      {
        "sceneIndex": 3,
        "slugline": "INT｜写字楼一楼电梯口｜午夜后",
        "purpose": "完成救援并交代选择的代价",
        "dramaticChange": "林夏失去提交机会，但救下周野",
        "environment": "暖色值班灯照进轿厢，湿地面映出黄色外套和散落文件。",
        "characterState": "林夏跪地按压周野左前臂，衬衫袖口沾水。",
        "elements": [
          {"type": "action", "content": "林夏用升职材料压住伤口并拨通急救电话。"},
          {"type": "dialogue", "speaker": "林夏", "performanceCue": "保持按压，声音稳定", "text": "地址是中庭路八十八号，他意识清醒。"},
          {"type": "action", "content": "手机显示提交超时，林夏没有松手。"}
        ]
      }
    ],
    "scriptText": "[TITLE]\n最后一班电梯\n\n[LOGLINE]\n一名加班职员在午夜电梯里看见未来的自己，并在升职与救人之间作出选择。\n\n[STORY_SUMMARY]\n林夏为了升职试图关门避开受伤者，最终放弃倒计时并救人。\n\n[CHARACTERS]\n- 林夏｜主角｜短发，浅灰衬衫｜压力增大时压紧文件｜与周野原本互不相识\n- 周野｜受伤外卖员｜黄色防水外套，左前臂受伤｜保护餐盒｜被林夏救下\n\n[SCRIPT]\n\n[SCENE 1]\nSLUGLINE: INT｜写字楼电梯厅｜午夜前\nSCENE_PURPOSE: 建立冲突\nDRAMATIC_CHANGE: 林夏从关门转为阻止门关闭\nENVIRONMENT: 冷白顶灯和室外雨水\nCHARACTER_STATE: 林夏抱着材料，周野跑向电梯\n\n[ACTION]\n林夏按下关门键，应急灯随后亮起。\n\n[END_SCENE]\n\n[SCENE 2]\nSLUGLINE: INT｜停在楼层之间的电梯｜午夜\nSCENE_PURPOSE: 展示后果\nDRAMATIC_CHANGE: 林夏接受救人的代价\nENVIRONMENT: 暖色应急灯照亮金属门\nCHARACTER_STATE: 林夏面对未来倒影\n\n[ACTION]\n倒影按住事故名单，林夏双手扒开门。\n\n[END_SCENE]\n\n[SCENE 3]\nSLUGLINE: INT｜写字楼一楼电梯口｜午夜后\nSCENE_PURPOSE: 完成救援\nDRAMATIC_CHANGE: 林夏失去提交机会但救下周野\nENVIRONMENT: 暖色值班灯照进轿厢\nCHARACTER_STATE: 林夏跪地按压伤口\n\n[ACTION]\n林夏用升职材料压住伤口并拨打急救电话。\n\n[END_SCENE]\n\n[END_SCRIPT]"
  },
  "storyBible": {
    "metadata": {
      "title": "最后一班电梯",
      "logline": "一名加班职员在午夜电梯里看见未来的自己，并在升职与救人之间作出选择。",
      "genre": "都市悬疑",
      "language": "zh-CN",
      "targetDurationSeconds": 60,
      "aspectRatio": "9:16",
      "tone": "克制、紧张，结尾留有温度",
      "visualStyle": "写实都市夜景；冷白办公灯、金属表面和暖色应急灯构成主要视觉对照",
      "directorialVoice": "观察式自然主义；大部分场面保持克制，关键选择通过动作和有来源的光线变化表达"
    },
    "worldSettings": {
      "timePeriod": "当代",
      "geography": "中国一线城市的深夜写字楼",
      "socialContext": "高压加班文化与陌生人之间的责任选择",
      "worldRules": ["电梯只在午夜零点短暂映出同一人物可能抵达的未来"],
      "environmentBaseline": "玻璃、金属和冷白顶灯构成办公楼基础空间；室外持续降雨。",
      "colorAndLightBaseline": "办公区域使用冷白顶灯；停电后使用轿厢顶部暖色应急灯；所有光线来自场内实际光源。",
      "coreThemes": ["选择的代价", "对陌生人的责任"],
      "forbiddenContradictions": ["未来倒影不得直接与当前人物交换物品", "核心事件不得离开写字楼与电梯空间"]
    }
  },
  "quality": {
    "passed": true,
    "score": 88,
    "problems": [],
    "summary": "冲突、转折、结局和可视化动作完整，可以进入后续生产。"
  },
  "rewriteCount": 1,
  "promptVersions": {
    "scriptExpander": "v1",
    "scriptGenerator": "v1",
    "scriptQualityChecker": "v1",
    "scriptRewriter": "v1",
    "storyBibleExtractor": "v1"
  }
}
